### ISSUE TITLE
edge access edge is normal, but edge and cloud access to each other is abnormal!

### ISSUE THREAD

**Issue by 844700118** [kubeedge/edgemesh#115]
**edge access edge is normal, but edge and cloud access to each other is abnormal!**

EdgeMesh version: release-1.8

Kubernetes version (use kubectl version): 1.19

KubeEdge version(e.g. cloudcore --version and edgecore --version): 1.8

**1. cloud node**

    [root@localhost ~]#  kubectl get pod -o wide -A
    NAMESPACE     NAME                                      READY   STATUS       RESTARTS   AGE     IP              NODE           NOMINATED NODE   READINESS GATES
	default       busybox-sleep-cloud                       1/1     Running      0          129m    10.1.235.198    k8s-master     <none>           <none>
	default       busybox-sleep-edge                        1/1     Running      0          129m    172.17.0.6      kubeedge-129   <none>           <none>
	default       nginx1-b97c459f7-s6t7w                    1/1     Running      0          3h48m   172.17.0.3      kubeedge-129   <none>           <none>
	default       nginx2-5fc4444698-4rgtj                   1/1     Running      0          3h48m   172.17.0.4      kubeedge-129   <none>           <none>
	default       tcp-echo-7f6868b7cd-5jxlz                 1/1     Running      0          114m    172.17.0.2      kubeedge-129   <none>           <none>
	default       tcp-echo-cloud                            1/1     Running      0          129m    10.1.235.197    k8s-master     <none>           <none>
	default       tcp-echo-edge                             1/1     Running      0          131m    172.17.0.5      kubeedge-129   <none>           <none>
	kube-system   calico-kube-controllers-bcc6f659f-l8mt7   1/1     Running      0          30h     10.1.235.195    k8s-master     <none>           <none>
	kube-system   calico-node-g77nv                         1/1     Running      0          30h     192.168.1.228   k8s-master     <none>           <none>
	kube-system   calico-node-r4vvl                         0/1     Init:Error   8          21h     192.168.1.81    kubeedge-129   <none>           <none>
	kube-system   coredns-6c76c8bb89-8j8hd                  1/1     Running      0          30h     10.1.235.193    k8s-master     <none>           <none>
	kube-system   coredns-6c76c8bb89-ksfv6                  1/1     Running      0          30h     10.1.235.194    k8s-master     <none>           <none>
	kube-system   etcd-k8s-master                           1/1     Running      0          30h     192.168.1.228   k8s-master     <none>           <none>
	kube-system   kube-apiserver-k8s-master                 1/1     Running      0          30h     192.168.1.228   k8s-master     <none>           <none>
	kube-system   kube-controller-manager-k8s-master        1/1     Running      0          30h     192.168.1.228   k8s-master     <none>           <none>
	kube-system   kube-proxy-74jbw                          1/1     Running      0          30h     192.168.1.228   k8s-master     <none>           <none>
	kube-system   kube-proxy-g7l4t                          1/1     Running      0          21h     192.168.1.81    kubeedge-129   <none>           <none>
	kube-system   kube-scheduler-k8s-master                 1/1     Running      0          30h     192.168.1.228   k8s-master     <none>           <none>
	kubeedge      edgemesh-agent-edge-98c4s                 1/1     Running      0          3h13m   192.168.1.81    kubeedge-129   <none>           <none>
	kubeedge      edgemesh-server-5f4d8b8b5b-jt9qm          1/1     Running      0          7h24m   192.168.1.228   k8s-master     <none>           <none>

	[root@localhost ~]#   kubectl get svc
	NAME                 TYPE        CLUSTER-IP     EXTERNAL-IP   PORT(S)    AGE
	kubernetes           ClusterIP   10.1.0.1       <none>        443/TCP    30h
	nginx1               ClusterIP   10.1.232.131   <none>        8001/TCP   3h51m
	nginx2               ClusterIP   10.1.166.230   <none>        8002/TCP   3h51m
	tcp-echo-cloud-svc   ClusterIP   10.1.133.252   <none>        2701/TCP   132m
	tcp-echo-edge-svc    ClusterIP   10.1.221.4     <none>        2701/TCP   134m
	tcp-echo-service     ClusterIP   10.1.34.169    <none>        2701/TCP   117m

**2. edge access edge success**

    [root@localhost ~]#  kubectl exec -it nginx2-5fc4444698-4rgtj bash
	telnet tcp-echo-service.default.svc.cluster.local 2701
	Welcome, you are connected to node kubeedge-129.
	In namespace default.
	With IP address 172.17.0.2.
	Service default.

**3. edge access cloud fail**

    [root@localhost ~]#  kubectl exec -it tcp-echo-edge sh
	telnet tcp-echo-cloud-svc.default.svc.cluster.local 2701
	blocking no response ......
	
    [root@localhost ~]#  kubectl logs -f -n kubeedge edgemesh-agent-edge-98c4s
	I1008 10:56:54.582465       1 dns.go:73] dns server parse tcp-echo-cloud-svc.default.svc.cluster.local. ip 10.1.133.252

**4. cloud access edge fail**

    [root@localhost ~]#  kubectl exec -it tcp-echo-cloud sh
	telnet tcp-echo-edge-svc.default.svc.cluster.local 2701
	blocking no response ......

**5. cloud access cloud success**

     [root@k8s-master ~]# kubectl exec -it busybox-sleep-cloud bash
        / # telnet tcp-echo-cloud-svc.default.svc.cluster.local 2701
        Welcome, you are connected to node k8s-master.
        Running on Pod tcp-echo-cloud.
        In namespace default.
        With IP address 10.1.235.197.
        Service default.

**6. edge and cloud access to each other is abnormal ?**

    edge access edge is normal, but edge access cloud is abnormal, cloudaccess edge is abnormal .
	please help me.

**Comment by Poorunga** [comment]
Can the cloud access edge succeed?

**Comment by 844700118** [comment]
[root@localhost ~]#  kubectl exec -it tcp-echo-edge sh
telnet tcp-echo-cloud-svc.default.svc.cluster.local 2701


blocking no response ......, edge  can not access cloud .

**Comment by 844700118** [comment]
cloud node need install edgemesh-agent ?

**Comment by Poorunga** [comment]
> cloud node need install edgemesh-agent

Yes, apply 06-configmap-cloud.yaml and 07-daemonset-cloud.yaml to install edgemesh-agent-cloud.

**Comment by 844700118** [comment]
https://raw.githubusercontent.com/kubeedge/edgemesh/main/build/agent/kubernetes/edgemesh-agent/07-daemonset-edge.yaml
This does not can install to cloud Nodes.

  nodeAffinity:
          requiredDuringSchedulingIgnoredDuringExecution:
            nodeSelectorTerms:
              - matchExpressions:
                  - key: node-role.kubernetes.io/edge
                    operator: Exists
                  - key: node-role.kubernetes.io/agent
                    operator: Exists
      containers:
        - name: edgemesh-agent
          env:
            - name: MY_NODE_NAME
              valueFrom:
                fieldRef:
                  fieldPath: spec.nodeName

**Comment by Poorunga** [comment]
why?

**Comment by 844700118** [comment]
[root@k8s-master edgemesh-1.8.0]# kubectl apply -f /root/edgemesh-1.8.0/build/agent/kubernetes/edgemesh-agent/07-daemonset-cloud.yaml
daemonset.apps/edgemesh-agent-cloud created

[root@k8s-master edgemesh-1.8.0]# kubectl get pod -o wide -A
NAMESPACE     NAME                                      READY   STATUS       RESTARTS   AGE     IP              NODE           NOMINATED NODE   READINESS GATES
default       busybox-sleep-cloud                       1/1     Running      5          18h     10.1.235.198    k8s-master     <none>           <none>
default       busybox-sleep-edge                        1/1     Running      5          18h     172.17.0.6      kubeedge-129   <none>           <none>
default       nginx1-b97c459f7-s6t7w                    1/1     Running      0          20h     172.17.0.3      kubeedge-129   <none>           <none>
default       nginx2-5fc4444698-4rgtj                   1/1     Running      0          20h     172.17.0.4      kubeedge-129   <none>           <none>
default       tcp-echo-7f6868b7cd-5jxlz                 1/1     Running      0          18h     172.17.0.2      kubeedge-129   <none>           <none>
default       tcp-echo-cloud                            1/1     Running      0          18h     10.1.235.197    k8s-master     <none>           <none>
default       tcp-echo-edge                             1/1     Running      0          18h     172.17.0.5      kubeedge-129   <none>           <none>
kube-system   calico-kube-controllers-bcc6f659f-l8mt7   1/1     Running      0          47h     10.1.235.195    k8s-master     <none>           <none>
kube-system   calico-node-g77nv                         1/1     Running      0          47h     192.168.1.228   k8s-master     <none>           <none>
kube-system   calico-node-r4vvl                         0/1     Init:Error   8          38h     192.168.1.81    kubeedge-129   <none>           <none>
kube-system   coredns-6c76c8bb89-8j8hd                  1/1     Running      0          47h     10.1.235.193    k8s-master     <none>           <none>
kube-system   coredns-6c76c8bb89-ksfv6                  1/1     Running      0          47h     10.1.235.194    k8s-master     <none>           <none>
kube-system   etcd-k8s-master                           1/1     Running      0          47h     192.168.1.228   k8s-master     <none>           <none>
kube-system   kube-apiserver-k8s-master                 1/1     Running      0          47h     192.168.1.228   k8s-master     <none>           <none>
kube-system   kube-controller-manager-k8s-master        1/1     Running      0          47h     192.168.1.228   k8s-master     <none>           <none>
kube-system   kube-proxy-74jbw                          1/1     Running      0          47h     192.168.1.228   k8s-master     <none>           <none>
kube-system   kube-proxy-g7l4t                          1/1     Running      0          38h     192.168.1.81    kubeedge-129   <none>           <none>
kube-system   kube-scheduler-k8s-master                 1/1     Running      0          47h     192.168.1.228   k8s-master     <none>           <none>
kubeedge      edgemesh-agent-edge-rxgf4                 1/1     Running      0          3m26s   192.168.1.81    kubeedge-129   <none>           <none>
kubeedge      edgemesh-server-5f4d8b8b5b-jt9qm          1/1     Running      0          24h     192.168.1.228   k8s-master     <none>           <none>

The edgemesh-agent-cloud list was not found !

**Comment by 844700118** [comment]
I found the reason. Thank you very much,  
@Poorunga

**Comment by 844700118** [comment]
[root@k8s-master ~]# kubectl describe pod -n kube-system coredns-565fc5c9d8-8qw94

      ......
      Warning  Unhealthy  15m (x2853 over 18h)    kubelet  (combined from similar events): Liveness probe failed: Get "http://10.1.235.195:8080/health": EOF
      Warning  BackOff    5m53s (x3130 over 18h)  kubelet  Back-off restarting failed container
      Warning  Unhealthy  54s (x985 over 18h)     kubelet  Readiness probe failed: Get "http://10.1.235.195:8181/ready": EOF

What is the reason for this?

**Comment by 844700118** [comment]
No, it's a master node. 

[root@k8s-master ~]# kubectl get pod -A -o wide |grep dns
     kube-system   coredns-565fc5c9d8-8qw94                  0/1     Running   265        19h    10.1.235.195    k8s-master     <none>           <none>

**Comment by Poorunga** [comment]
1. `kubectl get all -n kube-system` then print all logs for me.
2. `iptables -t nat -nvL` then print all logs for me.

**Comment by 844700118** [comment]
[root@k8s-master ~]#  kubectl get all -n kube-system

	NAME                                          READY   STATUS             RESTARTS   AGE
	pod/calico-kube-controllers-bcc6f659f-z4s89   1/1     Running            0          23h
	pod/calico-node-4mjp7                         1/1     Running            0          19h
	pod/coredns-565fc5c9d8-8qw94                  0/1     CrashLoopBackOff   265        19h
	pod/etcd-k8s-master                           1/1     Running            0          3d2h
	pod/kube-apiserver-k8s-master                 1/1     Running            0          3d2h
	pod/kube-controller-manager-k8s-master        1/1     Running            0          3d2h
	pod/kube-proxy-74jbw                          1/1     Running            0          3d2h
	pod/kube-proxy-fgf82                          1/1     Running            0          23h
	pod/kube-scheduler-k8s-master                 1/1     Running            0          3d2h

	NAME               TYPE        CLUSTER-IP   EXTERNAL-IP   PORT(S)                  AGE
	service/kube-dns   ClusterIP   10.1.0.10    <none>        53/UDP,53/TCP,9153/TCP   3d2h

	NAME                         DESIRED   CURRENT   READY   UP-TO-DATE   AVAILABLE   NODE SELECTOR                 AGE
	daemonset.apps/calico-node   1         1         1       1            1           beta.kubernetes.io/os=linux   23h
	daemonset.apps/kube-proxy    2         2         2       2            2           kubernetes.io/os=linux        3d2h

	NAME                                      READY   UP-TO-DATE   AVAILABLE   AGE
	deployment.apps/calico-kube-controllers   1/1     1            1           23h
	deployment.apps/coredns                   0/1     1            0           3d2h

	NAME                                                DESIRED   CURRENT   READY   AGE
	replicaset.apps/calico-kube-controllers-bcc6f659f   1         1         1       23h
	replicaset.apps/coredns-565fc5c9d8                  1         1         0       19h
	replicaset.apps/coredns-6c76c8bb89                  0         0         0       3d2h

[root@k8s-master ~]#  iptables -t nat -nvL

	Chain PREROUTING (policy ACCEPT 101 packets, 18578 bytes)
	 pkts bytes target     prot opt in     out     source               destination         
	16712 2686K cali-PREROUTING  all  --  *      *       0.0.0.0/0            0.0.0.0/0            /* cali:6gwbT8clXdHdC1b1 */
	16722 2688K EDGE-MESH  all  --  *      *       0.0.0.0/0            0.0.0.0/0            /* edgemesh root chain */
	41123 6205K KUBE-SERVICES  all  --  *      *       0.0.0.0/0            0.0.0.0/0            /* kubernetes service portals */
	40167 6145K TUNNEL-PORT  all  --  *      *       0.0.0.0/0            0.0.0.0/0            /* kubeedge tunnel port */

	Chain INPUT (policy ACCEPT 103 packets, 18295 bytes)
	 pkts bytes target     prot opt in     out     source               destination         

	Chain OUTPUT (policy ACCEPT 1184 packets, 70797 bytes)
	 pkts bytes target     prot opt in     out     source               destination         
	 170K   10M cali-OUTPUT  all  --  *      *       0.0.0.0/0            0.0.0.0/0            /* cali:tVnHkvAo15HuiPy0 */
	 170K   10M EDGE-MESH  all  --  *      *       0.0.0.0/0            0.0.0.0/0            /* edgemesh root chain */
	 523K   31M KUBE-SERVICES  all  --  *      *       0.0.0.0/0            0.0.0.0/0            /* kubernetes service portals */
	 523K   31M TUNNEL-PORT  all  --  *      *       0.0.0.0/0            0.0.0.0/0            /* kubeedge tunnel port */

	Chain POSTROUTING (policy ACCEPT 1217 packets, 72777 bytes)
	 pkts bytes target     prot opt in     out     source               destination         
	 528K   32M cali-POSTROUTING  all  --  *      *       0.0.0.0/0            0.0.0.0/0            /* cali:O3lYWMrLQYEMJtB5 */
	 528K   32M KUBE-POSTROUTING  all  --  *      *       0.0.0.0/0            0.0.0.0/0            /* kubernetes postrouting rules */

	Chain EDGE-MESH (2 references)
	 pkts bytes target     prot opt in     out     source               destination         
		0     0 RETURN     all  --  *      *       0.0.0.0/0            10.1.0.10            /* ignore kube-dns.kube-system service */
	  795 47700 RETURN     all  --  *      *       0.0.0.0/0            10.1.0.1             /* ignore kubernetes.default service */
	 4267  256K EDGE-MESH-TCP  tcp  --  *      *       0.0.0.0/0            10.1.0.0/16          /* tcp service proxy */

	Chain EDGE-MESH-TCP (1 references)
	 pkts bytes target     prot opt in     out     source               destination         
	 4267  256K DNAT       tcp  --  *      *       0.0.0.0/0            0.0.0.0/0            to:10.1.235.192:40001

	Chain KUBE-KUBELET-CANARY (0 references)
	 pkts bytes target     prot opt in     out     source               destination         

	Chain KUBE-MARK-DROP (0 references)
	 pkts bytes target     prot opt in     out     source               destination         
		0     0 MARK       all  --  *      *       0.0.0.0/0            0.0.0.0/0            MARK or 0x8000

	Chain KUBE-MARK-MASQ (5 references)
	 pkts bytes target     prot opt in     out     source               destination         
		0     0 MARK       all  --  *      *       0.0.0.0/0            0.0.0.0/0            MARK or 0x4000

	Chain KUBE-NODEPORTS (1 references)
	 pkts bytes target     prot opt in     out     source               destination         

	Chain KUBE-POSTROUTING (1 references)
	 pkts bytes target     prot opt in     out     source               destination         
	 1217 72777 RETURN     all  --  *      *       0.0.0.0/0            0.0.0.0/0            mark match ! 0x4000/0x4000
		0     0 MARK       all  --  *      *       0.0.0.0/0            0.0.0.0/0            MARK xor 0x4000
		0     0 MASQUERADE  all  --  *      *       0.0.0.0/0            0.0.0.0/0            /* kubernetes service traffic requiring SNAT */

	Chain KUBE-PROXY-CANARY (0 references)
	 pkts bytes target     prot opt in     out     source               destination         

	Chain KUBE-SEP-FPBPMHNJLHP4BM5D (1 references)
	 pkts bytes target     prot opt in     out     source               destination         
		0     0 KUBE-MARK-MASQ  all  --  *      *       172.17.0.2           0.0.0.0/0            /* default/tcp-echo-edge-svc:tcp-0 */
		0     0 DNAT       tcp  --  *      *       0.0.0.0/0            0.0.0.0/0            /* default/tcp-echo-edge-svc:tcp-0 */ tcp to:172.17.0.2:2701

	Chain KUBE-SEP-MDOXK3E6ZZFKYAO3 (1 references)
	 pkts bytes target     prot opt in     out     source               destination         
		0     0 KUBE-MARK-MASQ  all  --  *      *       192.168.1.228        0.0.0.0/0            /* default/kubernetes:https */
		6   360 DNAT       tcp  --  *      *       0.0.0.0/0            0.0.0.0/0            /* default/kubernetes:https */ tcp to:192.168.1.228:6443

	Chain KUBE-SEP-SURBMCTRNMCBRRWW (1 references)
	 pkts bytes target     prot opt in     out     source               destination         
		0     0 KUBE-MARK-MASQ  all  --  *      *       10.1.235.203         0.0.0.0/0            /* default/tcp-echo-cloud-svc:tcp-0 */
		0     0 DNAT       tcp  --  *      *       0.0.0.0/0            0.0.0.0/0            /* default/tcp-echo-cloud-svc:tcp-0 */ tcp to:10.1.235.203:2701

	Chain KUBE-SEP-WQV3LHIOMCP5DKIS (1 references)
	 pkts bytes target     prot opt in     out     source               destination         
		0     0 KUBE-MARK-MASQ  all  --  *      *       172.17.0.3           0.0.0.0/0            /* default/nginx1 */
		0     0 DNAT       tcp  --  *      *       0.0.0.0/0            0.0.0.0/0            /* default/nginx1 */ tcp to:172.17.0.3:80

	Chain KUBE-SEP-WU2Z4K3PO4BJIUUD (1 references)
	 pkts bytes target     prot opt in     out     source               destination         
		0     0 KUBE-MARK-MASQ  all  --  *      *       172.17.0.4           0.0.0.0/0            /* default/nginx2 */
		0     0 DNAT       tcp  --  *      *       0.0.0.0/0            0.0.0.0/0            /* default/nginx2 */ tcp to:172.17.0.4:80

	Chain KUBE-SERVICES (2 references)
	 pkts bytes target     prot opt in     out     source               destination         
		0     0 KUBE-SVC-LALA4R66ZI6YVOT5  tcp  --  *      *       0.0.0.0/0            10.1.182.158         /* default/tcp-echo-edge-svc:tcp-0 cluster IP */ tcp dpt:2701
		0     0 KUBE-SVC-2ITKVE53LBRONKJW  tcp  --  *      *       0.0.0.0/0            10.1.166.230         /* default/nginx2 cluster IP */ tcp dpt:8002
		6   360 KUBE-SVC-NPX46M4PTMTKRN6Y  tcp  --  *      *       0.0.0.0/0            10.1.0.1             /* default/kubernetes:https cluster IP */ tcp dpt:443
		0     0 KUBE-SVC-XIIRZUZ4TSE776JC  tcp  --  *      *       0.0.0.0/0            10.1.126.141         /* default/tcp-echo-cloud-svc:tcp-0 cluster IP */ tcp dpt:2701
		0     0 KUBE-SVC-2BRRD7ARGUSQ7MRP  tcp  --  *      *       0.0.0.0/0            10.1.232.131         /* default/nginx1 cluster IP */ tcp dpt:8001
	 1119 67195 KUBE-NODEPORTS  all  --  *      *       0.0.0.0/0            0.0.0.0/0            /* kubernetes service nodeports; NOTE: this must be the last rule in this chain */ ADDRTYPE match dst-type LOCAL

	Chain KUBE-SVC-2BRRD7ARGUSQ7MRP (1 references)
	 pkts bytes target     prot opt in     out     source               destination         
		0     0 KUBE-SEP-WQV3LHIOMCP5DKIS  all  --  *      *       0.0.0.0/0            0.0.0.0/0            /* default/nginx1 */

	Chain KUBE-SVC-2ITKVE53LBRONKJW (1 references)
	 pkts bytes target     prot opt in     out     source               destination         
		0     0 KUBE-SEP-WU2Z4K3PO4BJIUUD  all  --  *      *       0.0.0.0/0            0.0.0.0/0            /* default/nginx2 */

	Chain KUBE-SVC-LALA4R66ZI6YVOT5 (1 references)
	 pkts bytes target     prot opt in     out     source               destination         
		0     0 KUBE-SEP-FPBPMHNJLHP4BM5D  all  --  *      *       0.0.0.0/0            0.0.0.0/0            /* default/tcp-echo-edge-svc:tcp-0 */

	Chain KUBE-SVC-NPX46M4PTMTKRN6Y (1 references)
	 pkts bytes target     prot opt in     out     source               destination         
		6   360 KUBE-SEP-MDOXK3E6ZZFKYAO3  all  --  *      *       0.0.0.0/0            0.0.0.0/0            /* default/kubernetes:https */

	Chain KUBE-SVC-XIIRZUZ4TSE776JC (1 references)
	 pkts bytes target     prot opt in     out     source               destination         
		0     0 KUBE-SEP-SURBMCTRNMCBRRWW  all  --  *      *       0.0.0.0/0            0.0.0.0/0            /* default/tcp-echo-cloud-svc:tcp-0 */

	Chain TUNNEL-PORT (2 references)
	 pkts bytes target     prot opt in     out     source               destination         
	   34  2040 DNAT       tcp  --  *      *       0.0.0.0/0            0.0.0.0/0            tcp dpt:10351 to:192.168.1.228:20003

	Chain cali-OUTPUT (1 references)
	 pkts bytes target     prot opt in     out     source               destination         
	 528K   32M cali-fip-dnat  all  --  *      *       0.0.0.0/0            0.0.0.0/0            /* cali:GBTAv2p5CwevEyJm */

	Chain cali-POSTROUTING (1 references)
	 pkts bytes target     prot opt in     out     source               destination         
	 528K   32M cali-fip-snat  all  --  *      *       0.0.0.0/0            0.0.0.0/0            /* cali:Z-c7XtVd2Bq7s_hA */
	 528K   32M cali-nat-outgoing  all  --  *      *       0.0.0.0/0            0.0.0.0/0            /* cali:nYKhEzDlr11Jccal */
		0     0 MASQUERADE  all  --  *      tunl0   0.0.0.0/0            0.0.0.0/0            /* cali:JHlpT-eSqR1TvyYm */ ADDRTYPE match src-type !LOCAL limit-out ADDRTYPE match src-type LOCAL

	Chain cali-PREROUTING (1 references)
	 pkts bytes target     prot opt in     out     source               destination         
	42653 6296K cali-fip-dnat  all  --  *      *       0.0.0.0/0            0.0.0.0/0            /* cali:r6XmIziWUJsdOK6Z */

	Chain cali-fip-dnat (2 references)
	 pkts bytes target     prot opt in     out     source               destination         

	Chain cali-fip-snat (1 references)
	 pkts bytes target     prot opt in     out     source               destination         

	Chain cali-nat-outgoing (1 references)
	 pkts bytes target     prot opt in     out     source               destination         
	  347 28857 MASQUERADE  all  --  *      *       0.0.0.0/0            0.0.0.0/0            /* cali:Dw4T8UWPnCLxRJiI */ match-set cali40masq-ipam-pools src ! match-set cali40all-ipam-pools dst

**Comment by 844700118** [comment]
edge node access cloud node success,  
edge node access edge node success,  
cloud  node access cloud  node success,  
but cloud  node access edge node fail,

**Comment by 844700118** [comment]
[root@k8s-master ~]#  kubectl logs -f -n kubeedge edgemesh-agent-cloud-pdfhw
	2021/10/09 11:30:42 INFO: Install client plugin, protocol: rest
	2021/10/09 11:30:42 INFO: Installed service discovery plugin: edge
	I1009 11:30:42.361342       1 server.go:54] Version: 1.8.0-dirty
	I1009 11:30:42.361373       1 server.go:88] [1] New informers manager
	W1009 11:30:42.361389       1 client_config.go:608] Neither --kubeconfig nor --master was specified.  Using the inClusterConfig.  This might not work.
	I1009 11:30:42.363046       1 server.go:95] [2] Register beehive modules
	I1009 11:30:42.363412       1 module.go:34] Module edgedns registered successfully
	I1009 11:30:42.652792       1 module.go:34] Module edgeproxy registered successfully
	W1009 11:30:42.652819       1 module.go:37] Module edgegateway is disabled, do not register
	I1009 11:30:42.653478       1 privkey.go:40] Private key exist, skip generate
	I1009 11:30:42.666838       1 module.go:34] Module tunnelagent registered successfully
	I1009 11:30:42.666867       1 server.go:104] [3] Install go-chassis plugins
	I1009 11:30:42.750587       1 log.go:181] DEBUG: Installed strategy plugin: [RoundRobin].
	I1009 11:30:42.750615       1 log.go:181] DEBUG: Installed strategy plugin: [Random].
	I1009 11:30:42.750623       1 log.go:181] DEBUG: Installed strategy plugin: [ConsistentHash].
	I1009 11:30:42.750642       1 log.go:181] DEBUG: ConfigurationFactory Initiated
	I1009 11:30:42.750655       1 log.go:181] INFO: Configuration files: []
	I1009 11:30:42.750690       1 log.go:181] WARN: empty configurtion from [FileSource]
	I1009 11:30:42.750698       1 log.go:181] INFO: invoke dynamic handler:FileSource
	I1009 11:30:42.750729       1 log.go:181] INFO: archaius init success
	I1009 11:30:42.750737       1 server.go:109] [4] Start informers manager
	I1009 11:30:42.750865       1 log.go:181] INFO: create new watcher
	I1009 11:30:42.951328       1 server.go:113] [5] Start all modules
	I1009 11:30:42.951469       1 core.go:24] Starting module edgedns
	I1009 11:30:42.951550       1 core.go:24] Starting module edgeproxy
	I1009 11:30:42.951586       1 core.go:24] Starting module tunnelagent
	W1009 11:30:42.951869       1 tunnel.go:28] Connection between agent and server [/ip4/192.168.1.228/tcp/10004 /ip4/127.0.0.1/tcp/10004 /ip4/192.168.1.228/tcp/10004] is not established, try connect
	I1009 11:30:42.951946       1 tunnel.go:31] Tunnel agent connecting to tunnel server
	I1009 11:30:42.960212       1 tunnel.go:50] agent success connected to server [/ip4/192.168.1.228/tcp/10004 /ip4/127.0.0.1/tcp/10004 /ip4/192.168.1.228/tcp/10004]
	I1009 11:38:15.545372       1 proxy.go:37] clusterIP: 10.1.235.195, servicePort: 8181
	W1009 11:38:03.706055       1 proxy.go:45] get protocol from sock error: protocol name:  or svcName:  is invalid


Does this error have anything to do with coredns? 
cloud node access edge node success,
edge node access edge node success,
cloud node access cloud node success,
but only edge node access cloud node fail,

**Comment by Poorunga** [comment]
@844700118 
kubeadm init --kubernetes-version=v1.18.20 --pod-network-cidr=10.244.0.0/16 --apiserver-advertise-address=192.168.0.229

10.244.0.0/16 is pod-network-cidr
If you don't specify a k8s cluster ip cidr, 10.96.0.0/12 is default value.

**Comment by 844700118** [comment]
Edgemesh's cross-subnet communication problem has been solved for 2 weeks. I got the guidance of Poorunga these days and made rapid progress. Thank Poorunga very much.
@Poorunga

**Comment by 844700118** [comment]
I'll try and reinstall the K8s. thanks.

**Comment by 844700118** [comment]
reate a few virtual machines locally for testing, I try this method.

**Comment by 844700118** [comment]
1.edge access cloud

	[root@kubeedge-129 ~]#  telnet tcp-echo-cloud-svc.default.svc.cluster.local 2701
		Trying 10.1.146.68...
		telnet: connect to address 10.1.146.68: Connection timed out

	[root@kubeedge-129 ~]# tcpdump -i any -s 0 tcp port 2701 -n -nn -tttt -l -X -v
		tcpdump: verbose output suppressed, use -v or -vv for full protocol decode
		listening on any, link-type LINUX_SLL (Linux cooked), capture size 262144 bytes
		2021-10-12 11:15:39.048466 IP 192.168.1.81.14367 > 10.233.235.204.2701: Flags [S], seq 3112586856, win 29200, options [mss 1460,sackOK,TS val 1284871148 ecr 0,nop,wscale 7], length 0
		192.168.1.81  => 10.333.235.204	TCP	76	[TCP Retransmission] 14367→2701 [SYN] Seq=0 Win=29200 Len=0 MSS=1460 SACK_PERM=1 TSval=1281771544 TSecr=0 WS=128

2.edge access edge

	[root@kubeedge-129 ~]# telnet tcp-echo-edge-svc.default.svc.cluster.local 2701
		Trying 10.1.65.64...
		Connected to tcp-echo-edge-svc.default.svc.cluster.local.
		Escape character is '^]'.
		Welcome, you are connected to node kubeedge-129.
		Running on Pod tcp-echo-edge-6f54447cb-fntpr.
		In namespace default.
		With IP address 172.17.0.3.
		Service default.

	[root@kubeedge-129 ~]# tcpdump -i any -s 0 tcp port 2701 -n -nn -tttt -l -v
		tcpdump: verbose output suppressed, use -v or -vv for full protocol decode
		listening on any, link-type LINUX_SLL (Linux cooked), capture size 262144 bytes
		2021-10-12 11:12:57.370070 IP 172.17.0.1.9775 > 172.17.0.3.2701: Flags [S], seq 3882083855, win 29200, options [mss 1460,sackOK,TS val 1284709470 ecr 0,nop,wscale 7], length 0
		2021-10-12 11:12:57.370080 IP 172.17.0.1.9775 > 172.17.0.3.2701: Flags [S], seq 3882083855, win 29200, options [mss 1460,sackOK,TS val 1284709470 ecr 0,nop,wscale 7], length 0
		2021-10-12 11:12:57.370171 IP 172.17.0.3.2701 > 172.17.0.1.9775: Flags [S.], seq 4117006129, ack 3882083856, win 28960, options [mss 1460,sackOK,TS val 1284709470 ecr 1284709470,nop,wscale 7], length 0
		2021-10-12 11:12:57.370171 IP 172.17.0.3.2701 > 192.168.1.81.39012: Flags [S.], seq 4117006129, ack 3882083856, win 28960, options [mss 1460,sackOK,TS val 1284709470 ecr 1284709470,nop,wscale 7], length 0
		2021-10-12 11:12:57.370197 IP 172.17.0.1.9775 > 172.17.0.3.2701: Flags [.], ack 1, win 229, options [nop,nop,TS val 1284709470 ecr 1284709470], length 0
		2021-10-12 11:12:57.370198 IP 172.17.0.1.9775 > 172.17.0.3.2701: Flags [.], ack 1, win 229, options [nop,nop,TS val 1284709470 ecr 1284709470], length 0
		2021-10-12 11:12:57.370437 IP 172.17.0.3.2701 > 172.17.0.1.9775: Flags [P.], seq 1:163, ack 1, win 227, options [nop,nop,TS val 1284709470 ecr 1284709470], length 162
		2021-10-12 11:12:57.370437 IP 172.17.0.3.2701 > 192.168.1.81.39012: Flags [P.], seq 1:163, ack 1, win 227, options [nop,nop,TS val 1284709470 ecr 1284709470], length 162
		2021-10-12 11:12:57.370458 IP 172.17.0.1.9775 > 172.17.0.3.2701: Flags [.], ack 163, win 237, options [nop,nop,TS val 1284709470 ecr 1284709470], length 0
		2021-10-12 11:12:57.370460 IP 172.17.0.1.9775 > 172.17.0.3.2701: Flags [.], ack 163, win 237, options [nop,nop,TS val 1284709470 ecr 1284709470], length 0

**Comment by 844700118** [comment]
1.edge access cloud

	[root@kubeedge-129 ~]#  telnet tcp-echo-cloud-svc.default.svc.cluster.local 2701
		Trying 10.1.146.68...
		telnet: connect to address 10.1.146.68: Connection timed out

	[root@kubeedge-129 ~]# tcpdump -i any -s 0 tcp port 2701 -n -nn -tttt -l -v
		2021-10-12 11:20:45.374207 IP 192.168.1.81.37293 > 10.233.235.204.2701: Flags [S], seq 1222960843, win 29200, options [mss 1460,sackOK,TS val 1285177474 ecr 0,nop,wscale 7], length 0
		2021-10-12 11:20:46.375945 IP 192.168.1.81.37293 > 10.233.235.204.2701: Flags [S], seq 1222960843, win 29200, options [mss 1460,sackOK,TS val 1285178476 ecr 0,nop,wscale 7], length 0
		2021-10-12 11:20:48.379984 IP 192.168.1.81.37293 > 10.233.235.204.2701: Flags [S], seq 1222960843, win 29200, options [mss 1460,sackOK,TS val 1285180480 ecr 0,nop,wscale 7], length 0
		192.168.1.81	10.233.235.204	TCP	76	[TCP Retransmission] 54238→2701 [SYN] Seq=0 Win=29200 Len=0 MSS=1460 SACK_PERM=1 TSval=1285279592 TSecr=0 WS=128
		

2.edge access edge

	[root@kubeedge-129 ~]# telnet tcp-echo-edge-svc.default.svc.cluster.local 2701
		Trying 10.1.65.64...
		Connected to tcp-echo-edge-svc.default.svc.cluster.local.
		Escape character is '^]'.
		Welcome, you are connected to node kubeedge-129.
		Running on Pod tcp-echo-edge-6f54447cb-fntpr.
		In namespace default.
		With IP address 172.17.0.3.
		Service default.

	[root@kubeedge-129 ~]# tcpdump -i any -s 0 tcp port 2701 -n -nn -tttt -l -v
		2021-10-12 11:19:38.860196 IP 172.17.0.1.43890 > 172.17.0.2.2701: Flags [S], seq 3537220034, win 29200, options [mss 1460,sackOK,TS val 1285110960 ecr 0,nop,wscale 7], length 0
		2021-10-12 11:19:38.860206 IP 172.17.0.1.43890 > 172.17.0.2.2701: Flags [S], seq 3537220034, win 29200, options [mss 1460,sackOK,TS val 1285110960 ecr 0,nop,wscale 7], length 0
		2021-10-12 11:19:38.860210 IP 172.17.0.1.43890 > 172.17.0.2.2701: Flags [S], seq 3537220034, win 29200, options [mss 1460,sackOK,TS val 1285110960 ecr 0,nop,wscale 7], length 0
		2021-10-12 11:19:38.860213 IP 172.17.0.1.43890 > 172.17.0.2.2701: Flags [S], seq 3537220034, win 29200, options [mss 1460,sackOK,TS val 1285110960 ecr 0,nop,wscale 7], length 0
		2021-10-12 11:19:38.860216 IP 172.17.0.1.43890 > 172.17.0.2.2701: Flags [S], seq 3537220034, win 29200, options [mss 1460,sackOK,TS val 1285110960 ecr 0,nop,wscale 7], length 0
		2021-10-12 11:19:38.860250 IP 172.17.0.2.2701 > 172.17.0.1.43890: Flags [S.], seq 1623150504, ack 3537220035, win 28960, options [mss 1460,sackOK,TS val 1285110960 ecr 1285110960,nop,wscale 7], length 0
		2021-10-12 11:19:38.860250 IP 172.17.0.2.2701 > 192.168.1.81.39032: Flags [S.], seq 1623150504, ack 3537220035, win 28960, options [mss 1460,sackOK,TS val 1285110960 ecr 1285110960,nop,wscale 7], length 0
		2021-10-12 11:19:38.860270 IP 172.17.0.1.43890 > 172.17.0.2.2701: Flags [.], ack 1, win 229, options [nop,nop,TS val 1285110960 ecr 1285110960], length 0
		2021-10-12 11:19:38.860272 IP 172.17.0.1.43890 > 172.17.0.2.2701: Flags [.], ack 1, win 229, options [nop,nop,TS val 1285110960 ecr 1285110960], length 0
		2021-10-12 11:19:38.861455 IP 172.17.0.2.2701 > 172.17.0.1.43890: Flags [P.], seq 1:163, ack 1, win 227, options [nop,nop,TS val 1285110961 ecr 1285110960], length 162
		2021-10-12 11:19:38.861455 IP 172.17.0.2.2701 > 192.168.1.81.39032: Flags [P.], seq 1:163, ack 1, win 227, options [nop,nop,TS val 1285110961 ecr 1285110960], length 162
		2021-10-12 11:19:38.861482 IP 172.17.0.1.43890 > 172.17.0.2.2701: Flags [.], ack 163, win 237, options [nop,nop,TS val 1285110961 ecr 1285110961], length 0
		2021-10-12 11:19:38.861484 IP 172.17.0.1.43890 > 172.17.0.2.2701: Flags [.], ack 163, win 237, options [nop,nop,TS val 1285110961 ecr 1285110961], length 0

**Comment by 844700118** [comment]
edge does not transfer from the mesh server, but directly accesses the pod ip, 192.168.1.81.56769> 10.233.235.204.2701, it must be Unreasonable.

On the edge node, how to debug and output the content of the mesh server communication response.

**Comment by 844700118** [comment]
[root@k8s-master edgemesh-agent]#     tcpdump -i any -s 0 tcp port 10004 -n -nn -tttt -l

    2021-10-12 15:30:09.166357 IP 192.168.1.228.10004 > 192.168.1.81.10006: Flags [P.], seq 4232330628:4232330658, ack 2936954257, win 263, options [nop,nop,TS val 1127456316 ecr 1300099192], length 30
    2021-10-12 15:30:09.166375 IP 127.0.0.1.10004 > 127.0.0.1.10006: Flags [P.], seq 2085096476:2085096506, ack 2938665214, win 360, options [nop,nop,TS val 1127456316 ecr 1127451317], length 30
    2021-10-12 15:30:09.166511 IP 192.168.1.228.10004 > 192.168.1.81.10006: Flags [P.], seq 30:642, ack 1, win 263, options [nop,nop,TS val 1127456316 ecr 1300099192], length 612
    2021-10-12 15:30:09.166537 IP 127.0.0.1.10004 > 127.0.0.1.10006: Flags [P.], seq 30:652, ack 1, win 360, options [nop,nop,TS val 1127456316 ecr 1127451317], length 622
    2021-10-12 15:30:09.166550 IP 127.0.0.1.10006 > 127.0.0.1.10004: Flags [.], ack 652, win 3635, options [nop,nop,TS val 1127456316 ecr 1127456316], length 0
    2021-10-12 15:30:09.166562 IP 192.168.1.228.10004 > 192.168.1.81.10006: Flags [P.], seq 642:672, ack 1, win 263, options [nop,nop,TS val 1127456316 ecr 1300099192], length 30
    2021-10-12 15:30:09.166562 IP 127.0.0.1.10004 > 127.0.0.1.10006: Flags [P.], seq 652:682, ack 1, win 360, options [nop,nop,TS val 1127456316 ecr 1127456316], length 30
    2021-10-12 15:30:09.166641 IP 192.168.1.81.10006 > 192.168.1.228.10004: Flags [.], ack 672, win 1424, options [nop,nop,TS val 1300104191 ecr 1127456316], length 0
    2021-10-12 15:30:09.166735 IP 192.168.1.81.10006 > 192.168.1.228.10004: Flags [P.], seq 1:31, ack 672, win 1424, options [nop,nop,TS val 1300104191 ecr 1127456316], length 30
    2021-10-12 15:30:09.166789 IP 127.0.0.1.10006 > 127.0.0.1.10004: Flags [P.], seq 1:31, ack 682, win 3635, options [nop,nop,TS val 1127456316 ecr 1127456316], length 30
    2021-10-12 15:30:09.166806 IP 127.0.0.1.10004 > 127.0.0.1.10006: Flags [.], ack 31, win 360, options [nop,nop,TS val 1127456316 ecr 1127456316], length 0
    2021-10-12 15:30:09.166811 IP 192.168.1.81.10006 > 192.168.1.228.10004: Flags [P.], seq 31:81, ack 672, win 1424, options [nop,nop,TS val 1300104191 ecr 1127456316], length 50
    2021-10-12 15:30:09.166934 IP 127.0.0.1.10006 > 127.0.0.1.10004: Flags [P.], seq 31:81, ack 682, win 3635, options [nop,nop,TS val 1127456317 ecr 1127456316], length 50
    2021-10-12 15:30:09.166943 IP 192.168.1.228.10004 > 192.168.1.81.10006: Flags [.], ack 81, win 263, options [nop,nop,TS val 1127456317 ecr 1300104191], length 0
    2021-10-12 15:30:09.166949 IP 127.0.0.1.10004 > 127.0.0.1.10006: Flags [.], ack 81, win 360, options [nop,nop,TS val 1127456317 ecr 1127456317], length 0
    2021-10-12 15:30:09.167027 IP 127.0.0.1.10006 > 127.0.0.1.10004: Flags [P.], seq 81:132, ack 682, win 3635, options [nop,nop,TS val 1127456317 ecr 1127456317], length 51
    2021-10-12 15:30:09.167038 IP 127.0.0.1.10004 > 127.0.0.1.10006: Flags [.], ack 132, win 360, options [nop,nop,TS val 1127456317 ecr 1127456317], length 0
    2021-10-12 15:30:09.167270 IP 192.168.1.81.10006 > 192.168.1.228.10004: Flags [P.], seq 81:132, ack 672, win 1424, options [nop,nop,TS val 1300104192 ecr 1127456317], length 51
    2021-10-12 15:30:09.167294 IP 192.168.1.81.10006 > 192.168.1.228.10004: Flags [P.], seq 132:162, ack 672, win 1424, options [nop,nop,TS val 1300104192 ecr 1127456317], length 30
    2021-10-12 15:30:09.167350 IP 192.168.1.228.10004 > 192.168.1.81.10006: Flags [.], ack 162, win 263, options [nop,nop,TS val 1127456317 ecr 1300104192], length 0
    2021-10-12 15:30:09.167487 IP 127.0.0.1.10006 > 127.0.0.1.10004: Flags [P.], seq 132:162, ack 682, win 3635, options [nop,nop,TS val 1127456317 ecr 1127456317], length 30
    2021-10-12 15:30:09.167498 IP 127.0.0.1.10004 > 127.0.0.1.10006: Flags [.], ack 162, win 360, options [nop,nop,TS val 1127456317 ecr 1127456317], length 0

**Comment by Poorunga** [comment]
I can't see what's wrong, this is my configuration, maybe you can refer to it.

```
[root@k8s-master ~]# cat /etc/kubeedge/config/cloudcore.yaml 
apiVersion: cloudcore.config.kubeedge.io/v1alpha1
commonConfig:
  tunnelPort: 10350
kind: CloudCore
kubeAPIConfig:
  burst: 200
  contentType: application/vnd.kubernetes.protobuf
  kubeConfig: /root/.kube/config
  master: ""
  qps: 100
modules:
  cloudHub:
    advertiseAddress:
    - 119.8.111.84
    dnsNames:
    - ""
    edgeCertSigningDuration: 365
    enable: true
    https:
      address: 0.0.0.0
      enable: true
      port: 10002
    keepaliveInterval: 30
    nodeLimit: 1000
    quic:
      address: 0.0.0.0
      enable: false
      maxIncomingStreams: 10000
      port: 10001
    tlsCAFile: /etc/kubeedge/ca/rootCA.crt
    tlsCAKeyFile: /etc/kubeedge/ca/rootCA.key
    tlsCertFile: /etc/kubeedge/certs/server.crt
    tlsPrivateKeyFile: /etc/kubeedge/certs/server.key
    tokenRefreshDuration: 12
    unixsocket:
      address: unix:///var/lib/kubeedge/kubeedge.sock
      enable: true
    websocket:
      address: 0.0.0.0
      enable: true
      port: 10000
    writeTimeout: 30
  cloudStream:
    enable: true
    streamPort: 10003
    tlsStreamCAFile: /etc/kubeedge/ca/streamCA.crt
    tlsStreamCertFile: /etc/kubeedge/certs/stream.crt
    tlsStreamPrivateKeyFile: /etc/kubeedge/certs/stream.key
    tlsTunnelCAFile: /etc/kubeedge/ca/rootCA.crt
    tlsTunnelCertFile: /etc/kubeedge/certs/server.crt
    tlsTunnelPrivateKeyFile: /etc/kubeedge/certs/server.key
    tunnelPort: 10004
  deviceController:
    buffer:
      deviceEvent: 1
      deviceModelEvent: 1
      updateDeviceStatus: 1024
    context:
      receiveModule: devicecontroller
      responseModule: cloudhub
      sendModule: cloudhub
    enable: true
    load:
      updateDeviceStatusWorkers: 1
  dynamicController:
    enable: true
  edgeController:
    buffer:
      configMapEvent: 1
      deletePod: 1024
      endpointsEvent: 1
      podEvent: 1
      queryConfigMap: 1024
      queryEndpoints: 1024
      queryNode: 1024
      queryPersistentVolume: 1024
      queryPersistentVolumeClaim: 1024
      querySecret: 1024
      queryService: 1024
      queryVolumeAttachment: 1024
      ruleEndpointsEvent: 1
      rulesEvent: 1
      secretEvent: 1
      serviceAccountToken: 1024
      serviceEvent: 1
      updateNode: 1024
      updateNodeStatus: 1024
      updatePodStatus: 1024
    context:
      receiveModule: edgecontroller
      responseModule: cloudhub
      sendModule: cloudhub
      sendRouterModule: router
    enable: true
    load:
      ServiceAccountTokenWorkers: 4
      UpdateRuleStatusWorkers: 4
      deletePodWorkers: 4
      queryConfigMapWorkers: 4
      queryEndpointsWorkers: 4
      queryNodeWorkers: 4
      queryPersistentVolumeClaimWorkers: 4
      queryPersistentVolumeWorkers: 4
      querySecretWorkers: 4
      queryServiceWorkers: 4
      queryVolumeAttachmentWorkers: 4
      updateNodeStatusWorkers: 1
      updateNodeWorkers: 4
      updatePodStatusWorkers: 1
    nodeUpdateFrequency: 10
  router:
    address: 0.0.0.0
    enable: false
    port: 9443
    restTimeout: 60
  syncController:
    enable: true
```

```
[root@ke-edge1 ~]# cat /etc/kubeedge/config/edgecore.yaml 
apiVersion: edgecore.config.kubeedge.io/v1alpha1
database:
  aliasName: default
  dataSource: /var/lib/kubeedge/edgecore.db
  driverName: sqlite3
kind: EdgeCore
modules:
  dbTest:
    enable: false
  deviceTwin:
    enable: true
  edgeHub:
    enable: true
    heartbeat: 15
    httpServer: https://119.8.111.84:10002
    projectID: e632aba927ea4ac2b575ec1603d56f10
    quic:
      enable: false
      handshakeTimeout: 30
      readDeadline: 15
      server: 192.168.5.187:10001
      writeDeadline: 15
    rotateCertificates: true
    tlsCaFile: /etc/kubeedge/ca/rootCA.crt
    tlsCertFile: /etc/kubeedge/certs/server.crt
    tlsPrivateKeyFile: /etc/kubeedge/certs/server.key
    token: d2dfdb221375996d6c9c76f3d91e8c0cb762443cdd7d409cbabbcbf337f75068.eyJhbGciOiJIUzI1NiIsInR5cCI6IkpXVCJ9.eyJleHAiOjE2MzQwMjQ2OTJ9.18Ww8CRGCBqGrqu1DSSgeCqhl2xcCbNQJbXDQLsuh7Y
    websocket:
      enable: true
      handshakeTimeout: 30
      readDeadline: 15
      server: 119.8.111.84:10000
      writeDeadline: 15
  edgeStream:
    enable: true
    handshakeTimeout: 30
    readDeadline: 15
    server: 119.8.111.84:10004
    tlsTunnelCAFile: /etc/kubeedge/ca/rootCA.crt
    tlsTunnelCertFile: /etc/kubeedge/certs/server.crt
    tlsTunnelPrivateKeyFile: /etc/kubeedge/certs/server.key
    writeDeadline: 15
  edged:
    cgroupDriver: cgroupfs
    cgroupRoot: ""
    cgroupsPerQOS: true
    clusterDNS: ""
    clusterDomain: ""
    cniBinDir: /opt/cni/bin
    cniCacheDirs: /var/lib/cni/cache
    cniConfDir: /etc/cni/net.d
    concurrentConsumers: 5
    devicePluginEnabled: false
    dockerAddress: unix:///var/run/docker.sock
    edgedMemoryCapacity: 7852396000
    enable: true
    enableMetrics: true
    gpuPluginEnabled: false
    hostnameOverride: ke-edge1
    imageGCHighThreshold: 80
    imageGCLowThreshold: 40
    imagePullProgressDeadline: 60
    maximumDeadContainersPerPod: 1
    networkPluginMTU: 1500
    nodeIP: 192.168.5.187
    nodeStatusUpdateFrequency: 10
    podSandboxImage: kubeedge/pause:3.1
    registerNode: true
    registerNodeNamespace: default
    remoteImageEndpoint: unix:///var/run/dockershim.sock
    remoteRuntimeEndpoint: unix:///var/run/dockershim.sock
    runtimeRequestTimeout: 2
    runtimeType: docker
    volumeStatsAggPeriod: 60000000000
  eventBus:
    enable: true
    eventBusTLS:
      enable: false
      tlsMqttCAFile: /etc/kubeedge/ca/rootCA.crt
      tlsMqttCertFile: /etc/kubeedge/certs/server.crt
      tlsMqttPrivateKeyFile: /etc/kubeedge/certs/server.key
    mqttMode: 2
    mqttQOS: 0
    mqttRetain: false
    mqttServerExternal: tcp://127.0.0.1:1883
    mqttServerInternal: tcp://127.0.0.1:1884
    mqttSessionQueueSize: 100
  metaManager:
    contextSendGroup: hub
    contextSendModule: websocket
    enable: true
    metaServer:
      debug: false
      enable: true
    podStatusSyncInterval: 60
    remoteQueryTimeout: 60
  serviceBus:
    enable: false
```
